{
  "upload_id": "0190f86f-e0de-7f2a-a24c-0a6abf16ec81",
  "status": "committed",
  "object_prefix": "archive/v1/0190f870-1111-7f2a-a24c-0a6abf16ec81/0190f870-2222-7f2a-a24c-0a6abf16ec81/0190f86f-e0de-7f2a-a24c-0a6abf16ec81/",
  "series_count": 1,
  "total_bytes": 184243353,
  "consent_policy_version": "pilot-2026-07",
  "created_at": "2026-07-12T03:14:02Z",
  "updated_at": "2026-07-12T03:19:44Z",
  "committed_at": "2026-07-12T03:19:44Z",
  "manifest": {
    "key": "manifests/v1/0190f870-1111-7f2a-a24c-0a6abf16ec81/0190f870-2222-7f2a-a24c-0a6abf16ec81/0190f86f-e0de-7f2a-a24c-0a6abf16ec81.json",
    "sha256": "37b421fc8e492a9c7fc38e18473f01e15c781b32085d179646957c202b4955a3"
  }
}
